{
  "schema_version": 1,
  "meta": {
    "name": "sim-quickstart",
    "created": "2026-04-03T00:00:00Z",
    "template": "sim-quickstart"
  },
  "topology": {
    "runtime": {
      "name": "anolis-main",
      "http_port": 8080,
      "http_bind": "127.0.0.1",
      "cors_origins": ["http://localhost:3000", "http://127.0.0.1:3000"],
      "cors_allow_credentials": false,
      "shutdown_timeout_ms": 2000,
      "startup_timeout_ms": 30000,
      "polling_interval_ms": 500,
      "log_level": "info",
      "telemetry": {
        "enabled": false
      },
      "automation_enabled": false,
      "providers": [
        {
          "id": "sim0",
          "kind": "sim",
          "timeout_ms": 5000,
          "hello_timeout_ms": 2000,
          "ready_timeout_ms": 10000,
          "restart_policy": { "enabled": false }
        }
      ]
    },
    "providers": {
      "sim0": {
        "kind": "sim",
        "provider_name": "sim0",
        "startup_policy": "degraded",
        "simulation_mode": "non_interacting",
        "tick_rate_hz": 10.0,
        "devices": [
          { "id": "tempctl0",    "type": "tempctl",    "initial_temp": 25.0 },
          { "id": "motorctl0",   "type": "motorctl",   "max_speed": 3000.0 },
          { "id": "relayio0",    "type": "relayio" },
          { "id": "analogsensor0", "type": "analogsensor" }
        ]
      }
    }
  },
  "paths": {
    "runtime_executable": "build/dev-windows-release/core/anolis-runtime.exe",
    "providers": {
      "sim0": {
        "executable": "../anolis-provider-sim/build/dev-windows-release/Release/anolis-provider-sim.exe"
      }
    }
  }
}
